{
  "scenario": "Literal syntax",
  "description": "Literal content placed directly into the pattern",
  "defaultTestProperties": {
    "testSubtype": "syntax"
  },
  "tests": [
    {
      "description": "Includes basic literals",
      "locale": "en-US",
      "pattern": "hello world",
      "verify": "hello world"
    },
    {
      "description": "Includes unquoted literals",
      "locale": "en-US",
      "pattern": "hello {world}",
      "verify": "hello world"
    },
    {
      "description": "Includes quoted literals",
      "locale": "en-US",
      "pattern": "hello {|world|}",
      "verify": "hello world"
    },
    {
      "description": "Allows empty quoted literals",
      "locale": "en-US",
      "pattern": "hello {||}",
      "verify": "hello "
    }
  ]
}
