{
  "scenario": "Whitespace",
  "description": "Leading and trailing space characters",
  "defaultTestProperties": {
    "testSubtype": "syntax"
  },
  "tests": [
    {
      "description": "Preserves leading space on basic literals",
      "locale": "en-US",
      "pattern": "  hello world",
      "verify": "  hello world"
    },
    {
      "description": "Removes leading space on unquoted literals",
      "locale": "en-US",
      "pattern": "hello {  world}",
      "verify": "hello world"
    },
    {
      "description": "Preserves trailing space on basic literals",
      "locale": "en-US",
      "pattern": "hello world  ",
      "verify": "hello world  "
    },
    {
      "description": "Removes trailing space on unquoted literals",
      "locale": "en-US",
      "pattern": "hello {world  }",
      "verify": "hello world"
    }
  ]
}
